{
  "accepted": {
    "email": "zyfeng@tju.edu.cn",
    "mentor_status": "active",
    "name": "冯志勇",
    "organization_id": null,
    "profile_url": "https://scs.tju.edu.cn/jzgxq_detail.jsp?dept=%E8%BD%AF%E4%BB%B6%E6%9C%8D%E5%8A%A1%E7%B3%BB&home=http%3A%2F%2Fcic.tju.edu.cn%2Ffaculty%2Fzyfeng%2Findex.html&name=%E5%86%AF%E5%BF%97%E5%8B%87&title=%E6%95%99%E6%8E%88&urltype=tree.TreeTempUrl&wbtreeid=1191",
    "recent_papers": [],
    "research_directions": [
      "软件工程、人工智能、服务计算、知识工程、计算机认知"
    ],
    "source_url": "https://scs.tju.edu.cn/jyjx/yjsjy/yjsdsmd.htm",
    "submitted_department": "软件学院软件工程系",
    "submitted_school": "软件学院",
    "submitted_university": "天津大学",
    "title": "教授"
  },
  "auto_eligible": false,
  "contributor": {
    "account_age_days_at_submission": 1530,
    "account_created_at": "2022-06-13T08:30:46Z",
    "github_login_at_submission": "JunieXD",
    "github_user_id": 107397009,
    "github_user_type": "User",
    "submitted_at": "2026-08-21T18:50:30Z"
  },
  "created_at": "2026-08-21T18:51:02Z",
  "id": "proposal_issue_148_row_2",
  "issue": {
    "batch_row": 2,
    "number": 148,
    "url": "https://github.com/JunieXD/AutoEmailSender-MentorData/issues/148"
  },
  "kind": "mentor_contribution",
  "match_status": "conflict",
  "review_reasons": [
    "unknown_department",
    "email_organization_conflict",
    "identity_requires_manual_review",
    "auto_merge_disabled"
  ],
  "schema_version": 1,
  "submitted": {
    "email": "zyfeng@tju.edu.cn",
    "mentor_status": "active",
    "name": "冯志勇",
    "organization_id": null,
    "profile_url": "https://scs.tju.edu.cn/jzgxq_detail.jsp?dept=%E8%BD%AF%E4%BB%B6%E6%9C%8D%E5%8A%A1%E7%B3%BB&home=http%3A%2F%2Fcic.tju.edu.cn%2Ffaculty%2Fzyfeng%2Findex.html&name=%E5%86%AF%E5%BF%97%E5%8B%87&title=%E6%95%99%E6%8E%88&urltype=tree.TreeTempUrl&wbtreeid=1191",
    "recent_papers": [],
    "research_directions": [
      "软件工程、人工智能、服务计算、知识工程、计算机认知"
    ],
    "source_url": "https://scs.tju.edu.cn/jyjx/yjsjy/yjsdsmd.htm",
    "submitted_department": "软件学院软件工程系",
    "submitted_school": "软件学院",
    "submitted_university": "天津大学",
    "title": "教授"
  },
  "target_mentor_id": "mentor_9c49d15510a01c1855b0"
}
