{
  "accepted": {
    "email": "hdchen@semi.ac.cn",
    "mentor_status": "active",
    "name": "陈弘达",
    "organization_id": null,
    "profile_url": "https://semi.cas.cn/rcdw/yjsds/202309/t20230919_6890119.html",
    "recent_papers": [
      "H.D. Chen, K Liang, Q.M. Zeng, X.J. Li , Z.B. Chen , Y. Du, R.H. Wu,“Flip-chip bonded hybrid CMOS/SEED optoelectronic smart pixels,”IEE Proc. Optoelectronics, vol. 147, no. 1, pp.2-7(2000)",
      "H.D. Chen, K. Liang, Q. M. Zeng, X. J. Li, Z. B. Chen , Y. Du, R. H. Wu,“Hybrid GaAs MQW Modulators and Detectors Flip-Chip Bonded to Silicon CMOS Circuitry”, Proc. of the 2000 IEEE/LEOS Summer Topical Meetings, pp.19-20, Florida, USA, July 2000",
      "H.D. Chen, L.H. Mao, J. Tang, K. Liang, Y. Du, Y.Z. Huang, R.H. Wu, J. Feng, X.M. Ke, H.Y. Liu, Z.G. Wang,“16-Channel VCSEL Based Multiple Chip Modules”, 2002 Digest of the IEEE/LEOS Summer Topical Meetings, p15-16, Mont Tremblant, Canada, July 2002",
      "Chen Hongda, Shen Rongxuan, Mao Luhong, Tang Jun, Liang Kun, Du Yun, Huang Yongzhen, Wu Ronghan, Feng Jun, Ke Ximing, Liu Huanyan, Wang Zhigong“16-channel 0.35 mm CMOS/VCSEL Transmission modules”, Chinese Journal of Semiconductors, vol.24 no.3, pp.245-249, 2003",
      "Chen Hongda, Pei Weihua, Deng Hui, Tang Jim, Du Yun, Wu Ronghan,“RCE PD array/CMOS optoelectronic integrate devices”, 2004 Digest of the LEOS Summer Topical Meetings, pp. 63-64, San Diego, USA, June 2004",
      "Hongda Chen, Zenghui Sun, Haijun Liu, Peng Gao, \"A silicon light emitting devices in standard CMOS technology\", IEEE 1st International Conference on Group IV Photonics, Hong Kong, 2004",
      "Chen Hongda, Shen Rongxuan, Pei Weihua, Jia Jiuchun, Tang Jun, Zhou Yi,Xu Xingsheng“High Speed VCSEL-based Parallel Optical Transmission Modules”,Chinese Journal of Semiconductors,vol.26 no.8, pp.1500-1503, 2005",
      "CHEN Hong-Da, LIU Hai-Jun, LIU Jin-Bin, GU Ming, HUANG Bei-Ju.. Silicon Light Emitting Devices in CMOS Technology. Chinese Physics Letters, 24(1), 2007"
    ],
    "research_directions": [
      "微电子与光电子集成器件"
    ],
    "source_url": "http://hias.ucas.ac.cn/znkxyjs/szdw11/szdw1.htm",
    "submitted_department": "中国科学院半导体研究所",
    "submitted_school": "智能科学与技术学院",
    "submitted_university": "国科大杭州高等研究院",
    "title": "研究员"
  },
  "auto_eligible": false,
  "contributor": {
    "account_age_days_at_submission": 1518,
    "account_created_at": "2022-06-13T08:30:46Z",
    "github_login_at_submission": "JunieXD",
    "github_user_id": 107397009,
    "github_user_type": "User",
    "submitted_at": "2026-08-10T06:47:52Z"
  },
  "created_at": "2026-08-10T06:48:14Z",
  "id": "proposal_issue_28_row_74",
  "issue": {
    "batch_row": 74,
    "number": 28,
    "url": "https://github.com/JunieXD/AutoEmailSender-MentorData/issues/28"
  },
  "kind": "mentor_contribution",
  "match_status": "new",
  "review_reasons": [
    "unknown_university",
    "auto_merge_disabled"
  ],
  "schema_version": 1,
  "submitted": {
    "email": "hdchen@semi.ac.cn",
    "mentor_status": "active",
    "name": "陈弘达",
    "organization_id": null,
    "profile_url": "https://semi.cas.cn/rcdw/yjsds/202309/t20230919_6890119.html",
    "recent_papers": [
      "H.D. Chen, K Liang, Q.M. Zeng, X.J. Li , Z.B. Chen , Y. Du, R.H. Wu,“Flip-chip bonded hybrid CMOS/SEED optoelectronic smart pixels,”IEE Proc. Optoelectronics, vol. 147, no. 1, pp.2-7(2000)",
      "H.D. Chen, K. Liang, Q. M. Zeng, X. J. Li, Z. B. Chen , Y. Du, R. H. Wu,“Hybrid GaAs MQW Modulators and Detectors Flip-Chip Bonded to Silicon CMOS Circuitry”, Proc. of the 2000 IEEE/LEOS Summer Topical Meetings, pp.19-20, Florida, USA, July 2000",
      "H.D. Chen, L.H. Mao, J. Tang, K. Liang, Y. Du, Y.Z. Huang, R.H. Wu, J. Feng, X.M. Ke, H.Y. Liu, Z.G. Wang,“16-Channel VCSEL Based Multiple Chip Modules”, 2002 Digest of the IEEE/LEOS Summer Topical Meetings, p15-16, Mont Tremblant, Canada, July 2002",
      "Chen Hongda, Shen Rongxuan, Mao Luhong, Tang Jun, Liang Kun, Du Yun, Huang Yongzhen, Wu Ronghan, Feng Jun, Ke Ximing, Liu Huanyan, Wang Zhigong“16-channel 0.35 mm CMOS/VCSEL Transmission modules”, Chinese Journal of Semiconductors, vol.24 no.3, pp.245-249, 2003",
      "Chen Hongda, Pei Weihua, Deng Hui, Tang Jim, Du Yun, Wu Ronghan,“RCE PD array/CMOS optoelectronic integrate devices”, 2004 Digest of the LEOS Summer Topical Meetings, pp. 63-64, San Diego, USA, June 2004",
      "Hongda Chen, Zenghui Sun, Haijun Liu, Peng Gao, \"A silicon light emitting devices in standard CMOS technology\", IEEE 1st International Conference on Group IV Photonics, Hong Kong, 2004",
      "Chen Hongda, Shen Rongxuan, Pei Weihua, Jia Jiuchun, Tang Jun, Zhou Yi,Xu Xingsheng“High Speed VCSEL-based Parallel Optical Transmission Modules”,Chinese Journal of Semiconductors,vol.26 no.8, pp.1500-1503, 2005",
      "CHEN Hong-Da, LIU Hai-Jun, LIU Jin-Bin, GU Ming, HUANG Bei-Ju.. Silicon Light Emitting Devices in CMOS Technology. Chinese Physics Letters, 24(1), 2007"
    ],
    "research_directions": [
      "微电子与光电子集成器件"
    ],
    "source_url": "http://hias.ucas.ac.cn/znkxyjs/szdw11/szdw1.htm",
    "submitted_department": "中国科学院半导体研究所",
    "submitted_school": "智能科学与技术学院",
    "submitted_university": "国科大杭州高等研究院",
    "title": "研究员"
  },
  "target_mentor_id": null
}
