{
  "accepted": {
    "email": "eeyzhou@hnu.edu.cn",
    "mentor_status": "active",
    "name": "周易",
    "organization_id": null,
    "profile_url": "http://robotics.hnu.edu.cn/info/1176/2962.htm",
    "recent_papers": [
      "Yi Zhou, Guillermo Gallego, Shaojie Shen. Event-based Stereo Visual Odometry. IEEE Transactions on Robotics (Volume: 37,Issue: 5, Oct. 2021).",
      "Yi Zhou, Hongdong Li, and Laurent Kneip. Canny-VO: Visual Odometry with RGB-D Cameras Based on Geometric 3-D–2-DEdge Alignment. IEEE Transactions on Robotics (Volume: 35, Issue: 1, Feb. 2019): 184-199.",
      "Yi Zhou, Guillermo Gallego, Xiuyuan Lu, Siqi Liu, Shaojie Shen. Event-based MotionSegmentation with Spatio-Temporal Graph Cuts. IEEE Transactions on Neural Networks and Learning Systems (Volume: 34, Issue: 8, Aug. 2023).",
      "Yi Zhou, Guillermo Gallego, Henri Rebecq, Laurent Kneip, Hongdong Li, Davide Scaramuzza. Semi-dense 3d reconstruction with a stereo event camera. In Proceedings of the European Conference on Computer Vision (ECCV), pp. 235-251. 2018.",
      "Xiuyuan Lu*, Yi Zhou*,Junkai Niu, Sheng Zhongand Shaojie Shen. Event-based Visual-Inertial Velometer.InRobotics: Science and Systems(RSS)2024.",
      "Jinghang Li, Bangyan Liao,Xiuyuan Lu, Peidong Liu, Shaojie Shen,Yi Zhou.... Event-Aided Time-to-Collision Estimation for Autonomous Driving.In Proceedings of the European Conference on Computer Vision (ECCV),2024.",
      "ZhongyangRen, Bangyan Liao,Delei Kong, Jinghang Li, Peidong Liu, Laurent Kneip, Guillermo Gallego,Yi Zhou....Motion and Structure from Event-based Normal Flow.In Proceedings of the European Conference on Computer Vision (ECCV),2024.",
      "Junkai Niu, Sheng Zhong, Yi Zhou.... IMU-Aided Event-based Stereo Visual Odometry. The 2024 IEEE International Conference on Robotics and Automation (ICRA)."
    ],
    "research_directions": [
      "基于先进视觉传感器的机器人感知与导航技术,包括高速自主机器人技术、视觉里程计(VO/SLAM)、动态视觉传感器(Event-based Vision)、多视角几何理论等,具体研究方向为视觉里程计(VO)、同时定位和建图(SLAM)、3D计算机视觉、仿神经形态学的动态视觉传感(Dynamic Vision Sensor,e.g., Event-based Camera)"
    ],
    "source_url": "http://robotics.hnu.edu.cn/szdw/jsjj2.htm",
    "submitted_department": "湖南大学机器人学院",
    "submitted_school": "人工智能与机器人学院",
    "submitted_university": "湖南大学",
    "title": "教授"
  },
  "auto_eligible": false,
  "contributor": {
    "account_age_days_at_submission": 1530,
    "account_created_at": "2022-06-13T08:30:46Z",
    "github_login_at_submission": "JunieXD",
    "github_user_id": 107397009,
    "github_user_type": "User",
    "submitted_at": "2026-08-21T18:48:07Z"
  },
  "created_at": "2026-08-21T18:48:36Z",
  "id": "proposal_issue_127_row_49",
  "issue": {
    "batch_row": 49,
    "number": 127,
    "url": "https://github.com/JunieXD/AutoEmailSender-MentorData/issues/127"
  },
  "kind": "mentor_contribution",
  "match_status": "new",
  "review_reasons": [
    "unknown_school",
    "auto_merge_disabled"
  ],
  "schema_version": 1,
  "submitted": {
    "email": "eeyzhou@hnu.edu.cn",
    "mentor_status": "active",
    "name": "周易",
    "organization_id": null,
    "profile_url": "http://robotics.hnu.edu.cn/info/1176/2962.htm",
    "recent_papers": [
      "Yi Zhou, Guillermo Gallego, Shaojie Shen. Event-based Stereo Visual Odometry. IEEE Transactions on Robotics (Volume: 37,Issue: 5, Oct. 2021).",
      "Yi Zhou, Hongdong Li, and Laurent Kneip. Canny-VO: Visual Odometry with RGB-D Cameras Based on Geometric 3-D–2-DEdge Alignment. IEEE Transactions on Robotics (Volume: 35, Issue: 1, Feb. 2019): 184-199.",
      "Yi Zhou, Guillermo Gallego, Xiuyuan Lu, Siqi Liu, Shaojie Shen. Event-based MotionSegmentation with Spatio-Temporal Graph Cuts. IEEE Transactions on Neural Networks and Learning Systems (Volume: 34, Issue: 8, Aug. 2023).",
      "Yi Zhou, Guillermo Gallego, Henri Rebecq, Laurent Kneip, Hongdong Li, Davide Scaramuzza. Semi-dense 3d reconstruction with a stereo event camera. In Proceedings of the European Conference on Computer Vision (ECCV), pp. 235-251. 2018.",
      "Xiuyuan Lu*, Yi Zhou*,Junkai Niu, Sheng Zhongand Shaojie Shen. Event-based Visual-Inertial Velometer.InRobotics: Science and Systems(RSS)2024.",
      "Jinghang Li, Bangyan Liao,Xiuyuan Lu, Peidong Liu, Shaojie Shen,Yi Zhou.... Event-Aided Time-to-Collision Estimation for Autonomous Driving.In Proceedings of the European Conference on Computer Vision (ECCV),2024.",
      "ZhongyangRen, Bangyan Liao,Delei Kong, Jinghang Li, Peidong Liu, Laurent Kneip, Guillermo Gallego,Yi Zhou....Motion and Structure from Event-based Normal Flow.In Proceedings of the European Conference on Computer Vision (ECCV),2024.",
      "Junkai Niu, Sheng Zhong, Yi Zhou.... IMU-Aided Event-based Stereo Visual Odometry. The 2024 IEEE International Conference on Robotics and Automation (ICRA)."
    ],
    "research_directions": [
      "基于先进视觉传感器的机器人感知与导航技术,包括高速自主机器人技术、视觉里程计(VO/SLAM)、动态视觉传感器(Event-based Vision)、多视角几何理论等,具体研究方向为视觉里程计(VO)、同时定位和建图(SLAM)、3D计算机视觉、仿神经形态学的动态视觉传感(Dynamic Vision Sensor,e.g., Event-based Camera)"
    ],
    "source_url": "http://robotics.hnu.edu.cn/szdw/jsjj2.htm",
    "submitted_department": "湖南大学机器人学院",
    "submitted_school": "人工智能与机器人学院",
    "submitted_university": "湖南大学",
    "title": "教授"
  },
  "target_mentor_id": null
}
