{
  "accepted": {
    "email": "zhangmaowei@tyut.edu.cn",
    "mentor_status": "active",
    "name": "张茂伟",
    "organization_id": null,
    "profile_url": "https://eie.tyut.edu.cn/info/1071/5161.htm",
    "recent_papers": [
      "M. Zhang, X. He, Z. Dong, L. Wang, D. Liu. Unbalance error compensation method of aircraft APU turbine rotor based on blade sorting. IEEE Transactions on Instrumentation and Measurement, 2024.",
      "M. Zhang, D. Liu, Y. Liu. Recent progress in precision measurement and assembly optimization methods of the aero-engine multistage rotor: A comprehensive review. Measurement, 2024.",
      "M. Zhang, Y. Liu, R. Li, D. Wang, J. Tan. Perpendicularity detection of multistage rotor considering compensation of datum error. IEEE Transactions on Instrumentation and Measurement, 2022.",
      "M. Zhang, Y. Liu, D. Wang, J. Tan. A coaxiality measurement method for the aero-engine rotor based on common datum axis. Measurement, 2022.",
      "M. Zhang, Y. Liu, C. Sun, X. Wang, J. Tan. Precision measurement and evaluation of flatness error for the aero-engine rotor connection surface based on convex hull theory and an improved PSO algorithm. Measurement Science and Technology, 2020."
    ],
    "research_directions": [
      "装备智能测试、智能信息处理"
    ],
    "source_url": "https://eie.tyut.edu.cn/szdw/jsml.htm",
    "submitted_department": "电子信息系",
    "submitted_school": "电子信息工程学院",
    "submitted_university": "太原理工大学",
    "title": null
  },
  "auto_eligible": false,
  "contributor": {
    "account_age_days_at_submission": 1530,
    "account_created_at": "2022-06-13T08:30:46Z",
    "github_login_at_submission": "JunieXD",
    "github_user_id": 107397009,
    "github_user_type": "User",
    "submitted_at": "2026-08-21T18:50:19Z"
  },
  "created_at": "2026-08-21T18:50:49Z",
  "id": "proposal_issue_144_row_4",
  "issue": {
    "batch_row": 4,
    "number": 144,
    "url": "https://github.com/JunieXD/AutoEmailSender-MentorData/issues/144"
  },
  "kind": "mentor_contribution",
  "match_status": "new",
  "review_reasons": [
    "unknown_university",
    "auto_merge_disabled"
  ],
  "schema_version": 1,
  "submitted": {
    "email": "zhangmaowei@tyut.edu.cn",
    "mentor_status": "active",
    "name": "张茂伟",
    "organization_id": null,
    "profile_url": "https://eie.tyut.edu.cn/info/1071/5161.htm",
    "recent_papers": [
      "M. Zhang, X. He, Z. Dong, L. Wang, D. Liu. Unbalance error compensation method of aircraft APU turbine rotor based on blade sorting. IEEE Transactions on Instrumentation and Measurement, 2024.",
      "M. Zhang, D. Liu, Y. Liu. Recent progress in precision measurement and assembly optimization methods of the aero-engine multistage rotor: A comprehensive review. Measurement, 2024.",
      "M. Zhang, Y. Liu, R. Li, D. Wang, J. Tan. Perpendicularity detection of multistage rotor considering compensation of datum error. IEEE Transactions on Instrumentation and Measurement, 2022.",
      "M. Zhang, Y. Liu, D. Wang, J. Tan. A coaxiality measurement method for the aero-engine rotor based on common datum axis. Measurement, 2022.",
      "M. Zhang, Y. Liu, C. Sun, X. Wang, J. Tan. Precision measurement and evaluation of flatness error for the aero-engine rotor connection surface based on convex hull theory and an improved PSO algorithm. Measurement Science and Technology, 2020."
    ],
    "research_directions": [
      "装备智能测试、智能信息处理"
    ],
    "source_url": "https://eie.tyut.edu.cn/szdw/jsml.htm",
    "submitted_department": "电子信息系",
    "submitted_school": "电子信息工程学院",
    "submitted_university": "太原理工大学",
    "title": null
  },
  "target_mentor_id": null
}
