{
  "accepted": {
    "email": "lixun@hebut.edu.cn",
    "mentor_status": "active",
    "name": "李珣",
    "organization_id": null,
    "profile_url": "https://eie.hebut.edu.cn/szdw/jsml/jsjzj/60114.htm",
    "recent_papers": [
      "Xun Li et al, Applied Physics Letters, 2015, 107: 262105.",
      "Xun Liet al, Journal of Vacuum Science & Technology B, 2015, 33 (2):021208."
    ],
    "research_directions": [
      "新型电子材料与器件"
    ],
    "source_url": "https://eie.hebut.edu.cn/szdw/jsml/jsjzj/index1.htm",
    "submitted_department": "微纳所",
    "submitted_school": "电子信息工程学院",
    "submitted_university": "河北工业大学",
    "title": "讲师"
  },
  "auto_eligible": false,
  "contributor": {
    "account_age_days_at_submission": 1530,
    "account_created_at": "2022-06-13T08:30:46Z",
    "github_login_at_submission": "JunieXD",
    "github_user_id": 107397009,
    "github_user_type": "User",
    "submitted_at": "2026-08-21T18:48:01Z"
  },
  "created_at": "2026-08-21T18:48:34Z",
  "id": "proposal_issue_126_row_71",
  "issue": {
    "batch_row": 71,
    "number": 126,
    "url": "https://github.com/JunieXD/AutoEmailSender-MentorData/issues/126"
  },
  "kind": "mentor_contribution",
  "match_status": "new",
  "review_reasons": [
    "unknown_university",
    "auto_merge_disabled"
  ],
  "schema_version": 1,
  "submitted": {
    "email": "lixun@hebut.edu.cn",
    "mentor_status": "active",
    "name": "李珣",
    "organization_id": null,
    "profile_url": "https://eie.hebut.edu.cn/szdw/jsml/jsjzj/60114.htm",
    "recent_papers": [
      "Xun Li et al, Applied Physics Letters, 2015, 107: 262105.",
      "Xun Liet al, Journal of Vacuum Science & Technology B, 2015, 33 (2):021208."
    ],
    "research_directions": [
      "新型电子材料与器件"
    ],
    "source_url": "https://eie.hebut.edu.cn/szdw/jsml/jsjzj/index1.htm",
    "submitted_department": "微纳所",
    "submitted_school": "电子信息工程学院",
    "submitted_university": "河北工业大学",
    "title": "讲师"
  },
  "target_mentor_id": null
}
