{
  "accepted": {
    "email": "puxiaor@uestc.edu.cn",
    "mentor_status": "active",
    "name": "蒲晓蓉",
    "organization_id": null,
    "profile_url": "https://www.scse.uestc.edu.cn/info/1081/11024.htm",
    "recent_papers": [
      "Differential effects of size-specific particulate matter on lower respiratory infections in children: A multi-city time-series analysis in Sichuan, China",
      "TEMDnet: A Novel Deep Denoising Network for Transient Electromagnetic Signal with Signal-to-Image Transformation",
      "Probability-based Mask R-CNN for pulmonary embolism detection",
      "Dual Self-paced Multi-view Clustering",
      "Task-Driven Deep Learning for LDCT Image Denoising",
      "COVID-19中国诊疗方案的机器学习智能分析方法",
      "Low-dose CT Image Blind Denoising with Graph Convolutional Neural Networks",
      "Automatic Identification of Alzheimer's Disease and Epilepsy Based on MRI"
    ],
    "research_directions": [
      "计算机视觉、机器学习、医疗健康大数据、计算机操作系统等"
    ],
    "source_url": "https://www.scse.uestc.edu.cn/js_sz.jsp?urltype=tree.TreeTempUrl&wbtreeid=1081",
    "submitted_department": "计算机工程与应用系",
    "submitted_school": "计算机科学与工程学院(网络空间安全学院)",
    "submitted_university": "电子科技大学",
    "title": "教授"
  },
  "auto_eligible": false,
  "contributor": {
    "account_age_days_at_submission": 1520,
    "account_created_at": "2022-06-13T08:30:46Z",
    "github_login_at_submission": "JunieXD",
    "github_user_id": 107397009,
    "github_user_type": "User",
    "submitted_at": "2026-08-11T13:34:14Z"
  },
  "created_at": "2026-08-11T13:34:48Z",
  "id": "proposal_issue_69_row_93",
  "issue": {
    "batch_row": 93,
    "number": 69,
    "url": "https://github.com/JunieXD/AutoEmailSender-MentorData/issues/69"
  },
  "kind": "mentor_contribution",
  "match_status": "new",
  "review_reasons": [
    "unknown_university",
    "auto_merge_disabled"
  ],
  "schema_version": 1,
  "submitted": {
    "email": "puxiaor@uestc.edu.cn",
    "mentor_status": "active",
    "name": "蒲晓蓉",
    "organization_id": null,
    "profile_url": "https://www.scse.uestc.edu.cn/info/1081/11024.htm",
    "recent_papers": [
      "Differential effects of size-specific particulate matter on lower respiratory infections in children: A multi-city time-series analysis in Sichuan, China",
      "TEMDnet: A Novel Deep Denoising Network for Transient Electromagnetic Signal with Signal-to-Image Transformation",
      "Probability-based Mask R-CNN for pulmonary embolism detection",
      "Dual Self-paced Multi-view Clustering",
      "Task-Driven Deep Learning for LDCT Image Denoising",
      "COVID-19中国诊疗方案的机器学习智能分析方法",
      "Low-dose CT Image Blind Denoising with Graph Convolutional Neural Networks",
      "Automatic Identification of Alzheimer's Disease and Epilepsy Based on MRI"
    ],
    "research_directions": [
      "计算机视觉、机器学习、医疗健康大数据、计算机操作系统等"
    ],
    "source_url": "https://www.scse.uestc.edu.cn/js_sz.jsp?urltype=tree.TreeTempUrl&wbtreeid=1081",
    "submitted_department": "计算机工程与应用系",
    "submitted_school": "计算机科学与工程学院(网络空间安全学院)",
    "submitted_university": "电子科技大学",
    "title": "教授"
  },
  "target_mentor_id": null
}
