{
  "accepted": {
    "email": "fanchaomeng@jlu.edu.cn",
    "mentor_status": "active",
    "name": "孟凡超",
    "organization_id": null,
    "profile_url": "https://ee.jlu.edu.cn/info/1019/6642.htm",
    "recent_papers": [
      "Intracavity incoherent supercontinuum dynamics and rogue waves in a broadband dissipative soliton laser",
      "Voltage-controlled nonlinear optical properties in gold nanofilms via electrothermal effect",
      "Delayed optical feedback-regulated artificial soliton molecule in a femtosecond optical parametric oscillator",
      "Significant enhancement of multiple resonant sidebands in a soliton fiber laser",
      "Toward a self-driving ultrafast fiber laser",
      "Instabilities in a dissipative soliton-similariton laser using a scalar iterative map",
      "Intracavity coherent supercontinuum generation via high-order soliton dynamics in a dissipative soliton fiber laser",
      "Towards intelligent dual-comb lasers: automatic bidirectional mode-locking via genetic algorithm"
    ],
    "research_directions": [
      "超快光纤激光物理与技术"
    ],
    "source_url": "https://ee.jlu.edu.cn/szdw/gdkxygcx.htm",
    "submitted_department": "光电科学与工程系",
    "submitted_school": "电子科学与工程学院",
    "submitted_university": "吉林大学",
    "title": null
  },
  "auto_eligible": false,
  "contributor": {
    "account_age_days_at_submission": 1515,
    "account_created_at": "2022-06-13T08:30:46Z",
    "github_login_at_submission": "JunieXD",
    "github_user_id": 107397009,
    "github_user_type": "User",
    "submitted_at": "2026-08-07T06:59:37Z"
  },
  "created_at": "2026-08-07T07:00:02Z",
  "id": "proposal_issue_8_row_43",
  "issue": {
    "batch_row": 43,
    "number": 8,
    "url": "https://github.com/JunieXD/AutoEmailSender-MentorData/issues/8"
  },
  "kind": "mentor_contribution",
  "match_status": "new",
  "review_reasons": [
    "unknown_university",
    "auto_merge_disabled"
  ],
  "schema_version": 1,
  "submitted": {
    "email": "fanchaomeng@jlu.edu.cn",
    "mentor_status": "active",
    "name": "孟凡超",
    "organization_id": null,
    "profile_url": "https://ee.jlu.edu.cn/info/1019/6642.htm",
    "recent_papers": [
      "Intracavity incoherent supercontinuum dynamics and rogue waves in a broadband dissipative soliton laser",
      "Voltage-controlled nonlinear optical properties in gold nanofilms via electrothermal effect",
      "Delayed optical feedback-regulated artificial soliton molecule in a femtosecond optical parametric oscillator",
      "Significant enhancement of multiple resonant sidebands in a soliton fiber laser",
      "Toward a self-driving ultrafast fiber laser",
      "Instabilities in a dissipative soliton-similariton laser using a scalar iterative map",
      "Intracavity coherent supercontinuum generation via high-order soliton dynamics in a dissipative soliton fiber laser",
      "Towards intelligent dual-comb lasers: automatic bidirectional mode-locking via genetic algorithm"
    ],
    "research_directions": [
      "超快光纤激光物理与技术"
    ],
    "source_url": "https://ee.jlu.edu.cn/szdw/gdkxygcx.htm",
    "submitted_department": "光电科学与工程系",
    "submitted_school": "电子科学与工程学院",
    "submitted_university": "吉林大学",
    "title": null
  },
  "target_mentor_id": null
}
