{
  "accepted": {
    "email": "danwang@xidian.edu.cn",
    "mentor_status": "active",
    "name": "王丹",
    "organization_id": null,
    "profile_url": "https://faculty.xidian.edu.cn/WANGDAN/zh_CN/index.htm",
    "recent_papers": [],
    "research_directions": [
      "强化学习、知识图谱、区块链、知识建模与计算、智能网络资源管理"
    ],
    "source_url": "https://hz.xidian.edu.cn/info/1201/40244.htm",
    "submitted_department": "空天地一体化综合业务网全国重点实验室",
    "submitted_school": "杭州研究院",
    "submitted_university": "西安电子科技大学",
    "title": "副教授"
  },
  "auto_eligible": false,
  "contributor": {
    "account_age_days_at_submission": 1520,
    "account_created_at": "2022-06-13T08:30:46Z",
    "github_login_at_submission": "JunieXD",
    "github_user_id": 107397009,
    "github_user_type": "User",
    "submitted_at": "2026-08-11T10:04:15Z"
  },
  "created_at": "2026-08-11T10:04:39Z",
  "id": "proposal_issue_34_row_162",
  "issue": {
    "batch_row": 162,
    "number": 34,
    "url": "https://github.com/JunieXD/AutoEmailSender-MentorData/issues/34"
  },
  "kind": "mentor_contribution",
  "match_status": "new",
  "review_reasons": [
    "unknown_university",
    "auto_merge_disabled"
  ],
  "schema_version": 1,
  "submitted": {
    "email": "danwang@xidian.edu.cn",
    "mentor_status": "active",
    "name": "王丹",
    "organization_id": null,
    "profile_url": "https://faculty.xidian.edu.cn/WANGDAN/zh_CN/index.htm",
    "recent_papers": [],
    "research_directions": [
      "强化学习、知识图谱、区块链、知识建模与计算、智能网络资源管理"
    ],
    "source_url": "https://hz.xidian.edu.cn/info/1201/40244.htm",
    "submitted_department": "空天地一体化综合业务网全国重点实验室",
    "submitted_school": "杭州研究院",
    "submitted_university": "西安电子科技大学",
    "title": "副教授"
  },
  "target_mentor_id": null
}
