{
  "accepted": {
    "email": "di.guo@bupt.edu.cn",
    "mentor_status": "active",
    "name": "郭迪",
    "organization_id": null,
    "profile_url": null,
    "recent_papers": [],
    "research_directions": [
      "具身智能、智能机器人、多模态融合"
    ],
    "source_url": "https://ai.bupt.edu.cn/szdw/szyl/znkxyjsx.htm",
    "submitted_department": "智能科学与技术系",
    "submitted_school": "人工智能学院",
    "submitted_university": "北京邮电大学",
    "title": "教授"
  },
  "auto_eligible": false,
  "contributor": {
    "account_age_days_at_submission": 1526,
    "account_created_at": "2022-06-13T08:30:46Z",
    "github_login_at_submission": "JunieXD",
    "github_user_id": 107397009,
    "github_user_type": "User",
    "submitted_at": "2026-08-17T10:22:08Z"
  },
  "created_at": "2026-08-17T10:22:42Z",
  "id": "proposal_issue_87_row_19",
  "issue": {
    "batch_row": 19,
    "number": 87,
    "url": "https://github.com/JunieXD/AutoEmailSender-MentorData/issues/87"
  },
  "kind": "mentor_contribution",
  "match_status": "new",
  "review_reasons": [
    "unknown_school",
    "auto_merge_disabled"
  ],
  "schema_version": 1,
  "submitted": {
    "email": "di.guo@bupt.edu.cn",
    "mentor_status": "active",
    "name": "郭迪",
    "organization_id": null,
    "profile_url": null,
    "recent_papers": [],
    "research_directions": [
      "具身智能、智能机器人、多模态融合"
    ],
    "source_url": "https://ai.bupt.edu.cn/szdw/szyl/znkxyjsx.htm",
    "submitted_department": "智能科学与技术系",
    "submitted_school": "人工智能学院",
    "submitted_university": "北京邮电大学",
    "title": "教授"
  },
  "target_mentor_id": null
}
