{
  "accepted": {
    "email": "lizhu@ncu.edu.cn",
    "mentor_status": "active",
    "name": "朱莉",
    "organization_id": null,
    "profile_url": "https://teacher.ncu.edu.cn/publish/091987",
    "recent_papers": [],
    "research_directions": [
      "人工智能算法及认知神经科学机制,具体包括(1)AI+医疗:基于脑胶质瘤、脓毒症、重症ICU数据、神经系统影像组学数据的疾病智能诊疗",
      "(2)AI+安全:基于可见光及遥感图像的弱小目标检测与识别",
      "(3)AI+灾害预警:基于遥感GIS信息的地质灾害智能预测",
      "(4)人工智能算法的硬件实现",
      "(5)人脑注意力机制,选择注意力机制探索"
    ],
    "source_url": "https://ie.ncu.edu.cn/szdw/yjszdjs/xsxssyjszdjs.htm",
    "submitted_department": null,
    "submitted_school": "信息工程学院",
    "submitted_university": "南昌大学",
    "title": "教授"
  },
  "auto_eligible": false,
  "contributor": {
    "account_age_days_at_submission": 1530,
    "account_created_at": "2022-06-13T08:30:46Z",
    "github_login_at_submission": "JunieXD",
    "github_user_id": 107397009,
    "github_user_type": "User",
    "submitted_at": "2026-08-21T18:48:49Z"
  },
  "created_at": "2026-08-21T18:49:26Z",
  "id": "proposal_issue_131_row_99",
  "issue": {
    "batch_row": 99,
    "number": 131,
    "url": "https://github.com/JunieXD/AutoEmailSender-MentorData/issues/131"
  },
  "kind": "mentor_contribution",
  "match_status": "new",
  "review_reasons": [
    "unknown_university",
    "auto_merge_disabled"
  ],
  "schema_version": 1,
  "submitted": {
    "email": "lizhu@ncu.edu.cn",
    "mentor_status": "active",
    "name": "朱莉",
    "organization_id": null,
    "profile_url": "https://teacher.ncu.edu.cn/publish/091987",
    "recent_papers": [],
    "research_directions": [
      "人工智能算法及认知神经科学机制,具体包括(1)AI+医疗:基于脑胶质瘤、脓毒症、重症ICU数据、神经系统影像组学数据的疾病智能诊疗",
      "(2)AI+安全:基于可见光及遥感图像的弱小目标检测与识别",
      "(3)AI+灾害预警:基于遥感GIS信息的地质灾害智能预测",
      "(4)人工智能算法的硬件实现",
      "(5)人脑注意力机制,选择注意力机制探索"
    ],
    "source_url": "https://ie.ncu.edu.cn/szdw/yjszdjs/xsxssyjszdjs.htm",
    "submitted_department": null,
    "submitted_school": "信息工程学院",
    "submitted_university": "南昌大学",
    "title": "教授"
  },
  "target_mentor_id": null
}
