{
  "accepted": {
    "email": "hanguijun1220@163.com",
    "mentor_status": "active",
    "name": "韩桂君",
    "organization_id": null,
    "profile_url": "https://law.zuel.edu.cn/2025/0525/c16276a396801/page.htm",
    "recent_papers": [
      "积极老龄化视域下居家养老责任体系的省思与重塑",
      "即时配送行业从业人员权益保障的实践检视及法律规制",
      "社区养老公评人制度与独立倡导人制度的国际经验及中国因应",
      "诊所法律教育的耶鲁标本及其启示意义",
      "法学博雅教育探索",
      "构建长期护理保险制度",
      "“子贡方人”章新证",
      "从劳资正义思考和谐劳动关系之构建"
    ],
    "research_directions": [
      "经济法学、社会法学(劳动法与社会保障学)"
    ],
    "source_url": "https://law.zuel.edu.cn/szdw/list.htm",
    "submitted_department": "经济法学系",
    "submitted_school": "法学院",
    "submitted_university": "中南财经政法大学",
    "title": "教授"
  },
  "auto_eligible": false,
  "contributor": {
    "account_age_days_at_submission": 1530,
    "account_created_at": "2022-06-13T08:30:46Z",
    "github_login_at_submission": "JunieXD",
    "github_user_id": 107397009,
    "github_user_type": "User",
    "submitted_at": "2026-08-21T18:54:04Z"
  },
  "created_at": "2026-08-21T18:54:38Z",
  "id": "proposal_issue_182_row_20",
  "issue": {
    "batch_row": 20,
    "number": 182,
    "url": "https://github.com/JunieXD/AutoEmailSender-MentorData/issues/182"
  },
  "kind": "mentor_contribution",
  "match_status": "new",
  "review_reasons": [
    "unknown_university",
    "auto_merge_disabled"
  ],
  "schema_version": 1,
  "submitted": {
    "email": "hanguijun1220@163.com",
    "mentor_status": "active",
    "name": "韩桂君",
    "organization_id": null,
    "profile_url": "https://law.zuel.edu.cn/2025/0525/c16276a396801/page.htm",
    "recent_papers": [
      "积极老龄化视域下居家养老责任体系的省思与重塑",
      "即时配送行业从业人员权益保障的实践检视及法律规制",
      "社区养老公评人制度与独立倡导人制度的国际经验及中国因应",
      "诊所法律教育的耶鲁标本及其启示意义",
      "法学博雅教育探索",
      "构建长期护理保险制度",
      "“子贡方人”章新证",
      "从劳资正义思考和谐劳动关系之构建"
    ],
    "research_directions": [
      "经济法学、社会法学(劳动法与社会保障学)"
    ],
    "source_url": "https://law.zuel.edu.cn/szdw/list.htm",
    "submitted_department": "经济法学系",
    "submitted_school": "法学院",
    "submitted_university": "中南财经政法大学",
    "title": "教授"
  },
  "target_mentor_id": null
}
