{
  "accepted": {
    "email": "nan.gao@nankai.edu.cn",
    "mentor_status": "active",
    "name": "高楠",
    "organization_id": null,
    "profile_url": "https://cs.nankai.edu.cn/info/1150/2590.htm",
    "recent_papers": [
      "Wang, Z., Zhang, C., Deng, J., Hu, X., Jie, C.*,Gao, N.*, Yu, C., Zhang, H.*. Division of Labor and Collaboration Between Parents in Family Education: The Case of Homework Involvement in Chinese Families. CHI, 2026.[CCF A]",
      "Quan, J., Li, Z., Zhu, T. Q., Li, Y., Wang, B., Pratt, W., &Gao, N.*. Relational Mediators: LLM Chatbots as Boundary Objects in Psychotherapy. CSCW, 2026.[CCF A]",
      "Gao, N., Liu, Y., Tang, X., Liu, Y., Yu, C., Huang, Y., ... & Shi, Y. (2025). The Homework Wars: Exploring Emotions, Behaviours, and Conflicts in Parent-Child Homework Interactions. IMWUT/UbiComp, 2026.[CCF A]",
      "Gao, N., Yu, Z., Xu, Y., Yu, C., Wang, Y., Salim, F., Shi, Y. Leveraging Large Language Models for Generating Mobile Sensing Strategies in Human Behavior Modeling.UbiComp Workshop, 2024. [Best Paper Award]",
      "Gao, N., Rahaman, M. S., Shao, W., Ji, K., & Salim, F. D. Individual and Group-wise Classroom Seating Experience: Effects on Student Engagement in Different Courses. IMWUT/UbiComp, 2022.[CCF A]",
      "Gao, N., Marschall, M., Burry, J., Watkins, S., & Salim, F. D. Understanding Occupants’ Behaviour, Engagement, Emotion, and Comfort Indoors with Heterogeneous Sensors and Wearables.Scientific Data (Nature Portfolio), 2022.[IF = 10.8][PDF]",
      "Gao, N., Xue, H., Shao, W., Zhao, S., Qin, K. K., Prabowo, A., ... Salim, F. D. Generative Adversarial Networks for Spatio-temporal Data: A Survey.ACM Transactions on Intelligent Systems and Technology,2022.[IF = 10.489][PDF]",
      "Gao, N., Shao, W., Rahaman, M. S., Zhai, J., David, K., & Salim, F. D. (2021). Transfer Learning for Thermal Comfort Prediction in Multiple Cities.Building and Environment, 195, 107725.[SCI中科院一区]"
    ],
    "research_directions": [
      "人机交互、普适计算、心理健康干预、智能教育、情感计算"
    ],
    "source_url": "https://cs.nankai.edu.cn/szdw/fjs.htm",
    "submitted_department": "软件学院",
    "submitted_school": "软件学院",
    "submitted_university": "南开大学",
    "title": "副教授"
  },
  "auto_eligible": false,
  "contributor": {
    "account_age_days_at_submission": 1530,
    "account_created_at": "2022-06-13T08:30:46Z",
    "github_login_at_submission": "JunieXD",
    "github_user_id": 107397009,
    "github_user_type": "User",
    "submitted_at": "2026-08-21T18:48:56Z"
  },
  "created_at": "2026-08-21T18:49:24Z",
  "id": "proposal_issue_134_row_12",
  "issue": {
    "batch_row": 12,
    "number": 134,
    "url": "https://github.com/JunieXD/AutoEmailSender-MentorData/issues/134"
  },
  "kind": "mentor_contribution",
  "match_status": "new",
  "review_reasons": [
    "unknown_school",
    "auto_merge_disabled"
  ],
  "schema_version": 1,
  "submitted": {
    "email": "nan.gao@nankai.edu.cn",
    "mentor_status": "active",
    "name": "高楠",
    "organization_id": null,
    "profile_url": "https://cs.nankai.edu.cn/info/1150/2590.htm",
    "recent_papers": [
      "Wang, Z., Zhang, C., Deng, J., Hu, X., Jie, C.*,Gao, N.*, Yu, C., Zhang, H.*. Division of Labor and Collaboration Between Parents in Family Education: The Case of Homework Involvement in Chinese Families. CHI, 2026.[CCF A]",
      "Quan, J., Li, Z., Zhu, T. Q., Li, Y., Wang, B., Pratt, W., &Gao, N.*. Relational Mediators: LLM Chatbots as Boundary Objects in Psychotherapy. CSCW, 2026.[CCF A]",
      "Gao, N., Liu, Y., Tang, X., Liu, Y., Yu, C., Huang, Y., ... & Shi, Y. (2025). The Homework Wars: Exploring Emotions, Behaviours, and Conflicts in Parent-Child Homework Interactions. IMWUT/UbiComp, 2026.[CCF A]",
      "Gao, N., Yu, Z., Xu, Y., Yu, C., Wang, Y., Salim, F., Shi, Y. Leveraging Large Language Models for Generating Mobile Sensing Strategies in Human Behavior Modeling.UbiComp Workshop, 2024. [Best Paper Award]",
      "Gao, N., Rahaman, M. S., Shao, W., Ji, K., & Salim, F. D. Individual and Group-wise Classroom Seating Experience: Effects on Student Engagement in Different Courses. IMWUT/UbiComp, 2022.[CCF A]",
      "Gao, N., Marschall, M., Burry, J., Watkins, S., & Salim, F. D. Understanding Occupants’ Behaviour, Engagement, Emotion, and Comfort Indoors with Heterogeneous Sensors and Wearables.Scientific Data (Nature Portfolio), 2022.[IF = 10.8][PDF]",
      "Gao, N., Xue, H., Shao, W., Zhao, S., Qin, K. K., Prabowo, A., ... Salim, F. D. Generative Adversarial Networks for Spatio-temporal Data: A Survey.ACM Transactions on Intelligent Systems and Technology,2022.[IF = 10.489][PDF]",
      "Gao, N., Shao, W., Rahaman, M. S., Zhai, J., David, K., & Salim, F. D. (2021). Transfer Learning for Thermal Comfort Prediction in Multiple Cities.Building and Environment, 195, 107725.[SCI中科院一区]"
    ],
    "research_directions": [
      "人机交互、普适计算、心理健康干预、智能教育、情感计算"
    ],
    "source_url": "https://cs.nankai.edu.cn/szdw/fjs.htm",
    "submitted_department": "软件学院",
    "submitted_school": "软件学院",
    "submitted_university": "南开大学",
    "title": "副教授"
  },
  "target_mentor_id": null
}
