{
  "accepted": {
    "email": "zhangyushu@jxufe.edu.cn",
    "mentor_status": "active",
    "name": "张玉书",
    "organization_id": null,
    "profile_url": "http://cta.jxufe.edu.cn/home/teacherInfo/detail?fid=109051&uid=377564881",
    "recent_papers": [],
    "research_directions": [],
    "source_url": "https://cai.jxufe.edu.cn/news-list-daoshiduiwu.html",
    "submitted_department": null,
    "submitted_school": "计算机与人工智能学院",
    "submitted_university": "江西财经大学",
    "title": null
  },
  "auto_eligible": false,
  "contributor": {
    "account_age_days_at_submission": 1520,
    "account_created_at": "2022-06-13T08:30:46Z",
    "github_login_at_submission": "JunieXD",
    "github_user_id": 107397009,
    "github_user_type": "User",
    "submitted_at": "2026-08-11T13:33:30Z"
  },
  "created_at": "2026-08-11T13:33:57Z",
  "id": "proposal_issue_61_row_9",
  "issue": {
    "batch_row": 9,
    "number": 61,
    "url": "https://github.com/JunieXD/AutoEmailSender-MentorData/issues/61"
  },
  "kind": "mentor_contribution",
  "match_status": "new",
  "review_reasons": [
    "unknown_university",
    "auto_merge_disabled"
  ],
  "schema_version": 1,
  "submitted": {
    "email": "zhangyushu@jxufe.edu.cn",
    "mentor_status": "active",
    "name": "张玉书",
    "organization_id": null,
    "profile_url": "http://cta.jxufe.edu.cn/home/teacherInfo/detail?fid=109051&uid=377564881",
    "recent_papers": [],
    "research_directions": [],
    "source_url": "https://cai.jxufe.edu.cn/news-list-daoshiduiwu.html",
    "submitted_department": null,
    "submitted_school": "计算机与人工智能学院",
    "submitted_university": "江西财经大学",
    "title": null
  },
  "target_mentor_id": null
}
