{
  "accepted": {
    "email": "xykui@csu.edu.cn",
    "mentor_status": "active",
    "name": "奎晓燕",
    "organization_id": null,
    "profile_url": "http://faculty.csu.edu.cn/kuixiaoyan/zh_CN/index.htm",
    "recent_papers": [
      "TFKAN: Time-frequency KAN for long-term time series forecasting. Neurocomputing (IF: 6.5, 中科院二区Top), 2026, Accepted.",
      "MHDP:Discover driver genes based on Multi-view Hypergraph and Dynamic Reward-Penalty Feature Fusion Model, IEEE Transactions on Computational Biology and Bioinformatics(JCR 1区,CCF-B类期刊),2026,Accpted.",
      "TEM-Net: A Tri-Channel Edge-Aware Multi-Scale Network for Thyroid Nodule Segmentation in Ultrasound Images, Bioengineering(JCR 2区,IF 4.36), 2026 Accepted",
      "WaveEdge-Net: Hybrid Wavelet Attention and Edge-Aware Enhancement for Automatic Tumor Segmentation, Biomedical Signal Processing and Control (中科院2区,IF 5.7) ,2026,Accpted",
      "Cycle-LVDM: Cycle-Consistent Latent Variational Diffusion Model for Unpaired Medical Image Translation, 《Meta-Radiology》,2026年已录用",
      "Memory-Guided Random-Direction Feature Disentanglement Model for Multi-Phase MRI Translation, MICCAI 2026( 医学影像顶会),2026 Accpted",
      "A comprehensive survey on magnetic resonance image reconstruction[J]. Image and Vision Computing, 2025: 105832. JCR 1, IF 4.2",
      "基于频域交互与密集融合的人脸超分辨率重建. 《模式识别与人工智能》(复合影响因子: 2.145,CCF-T2),2026,已录用"
    ],
    "research_directions": [
      "模式识别与图像处理、机器视觉与智慧医疗、医疗大数据、智能医学影像分析、数据可视化与可视分析、教育信息化等"
    ],
    "source_url": "https://cse.csu.edu.cn/szdw/jsml.htm",
    "submitted_department": "信息与网络中心",
    "submitted_school": "计算机学院",
    "submitted_university": "中南大学",
    "title": "教授"
  },
  "auto_eligible": false,
  "contributor": {
    "account_age_days_at_submission": 1520,
    "account_created_at": "2022-06-13T08:30:46Z",
    "github_login_at_submission": "JunieXD",
    "github_user_id": 107397009,
    "github_user_type": "User",
    "submitted_at": "2026-08-11T13:32:03Z"
  },
  "created_at": "2026-08-11T13:32:36Z",
  "id": "proposal_issue_45_row_26",
  "issue": {
    "batch_row": 26,
    "number": 45,
    "url": "https://github.com/JunieXD/AutoEmailSender-MentorData/issues/45"
  },
  "kind": "mentor_contribution",
  "match_status": "new",
  "review_reasons": [
    "unknown_university",
    "auto_merge_disabled"
  ],
  "schema_version": 1,
  "submitted": {
    "email": "xykui@csu.edu.cn",
    "mentor_status": "active",
    "name": "奎晓燕",
    "organization_id": null,
    "profile_url": "http://faculty.csu.edu.cn/kuixiaoyan/zh_CN/index.htm",
    "recent_papers": [
      "TFKAN: Time-frequency KAN for long-term time series forecasting. Neurocomputing (IF: 6.5, 中科院二区Top), 2026, Accepted.",
      "MHDP:Discover driver genes based on Multi-view Hypergraph and Dynamic Reward-Penalty Feature Fusion Model, IEEE Transactions on Computational Biology and Bioinformatics(JCR 1区,CCF-B类期刊),2026,Accpted.",
      "TEM-Net: A Tri-Channel Edge-Aware Multi-Scale Network for Thyroid Nodule Segmentation in Ultrasound Images, Bioengineering(JCR 2区,IF 4.36), 2026 Accepted",
      "WaveEdge-Net: Hybrid Wavelet Attention and Edge-Aware Enhancement for Automatic Tumor Segmentation, Biomedical Signal Processing and Control (中科院2区,IF 5.7) ,2026,Accpted",
      "Cycle-LVDM: Cycle-Consistent Latent Variational Diffusion Model for Unpaired Medical Image Translation, 《Meta-Radiology》,2026年已录用",
      "Memory-Guided Random-Direction Feature Disentanglement Model for Multi-Phase MRI Translation, MICCAI 2026( 医学影像顶会),2026 Accpted",
      "A comprehensive survey on magnetic resonance image reconstruction[J]. Image and Vision Computing, 2025: 105832. JCR 1, IF 4.2",
      "基于频域交互与密集融合的人脸超分辨率重建. 《模式识别与人工智能》(复合影响因子: 2.145,CCF-T2),2026,已录用"
    ],
    "research_directions": [
      "模式识别与图像处理、机器视觉与智慧医疗、医疗大数据、智能医学影像分析、数据可视化与可视分析、教育信息化等"
    ],
    "source_url": "https://cse.csu.edu.cn/szdw/jsml.htm",
    "submitted_department": "信息与网络中心",
    "submitted_school": "计算机学院",
    "submitted_university": "中南大学",
    "title": "教授"
  },
  "target_mentor_id": null
}
