{
  "accepted": {
    "email": "weihantao1108@126.com",
    "mentor_status": "active",
    "name": "魏汉涛",
    "organization_id": null,
    "profile_url": "https://law.zuel.edu.cn/2025/0525/c16276a396073/page.htm",
    "recent_papers": [
      "魏汉涛:《刑法谦抑主义的应然走向》,《环球法律评论》2025年第1期(CLSCI)",
      "魏汉涛、桑宇:《应对人类基因科技潜在风险的模式选择》,《安徽师范大学学报》(社会科学版)2025年第1期(CSSCI扩)",
      "魏汉涛、桑宇:《微罪的刑法治理之困境与出路》,《河北大学学报》(社会科学版)2025年第4期(CSSCI扩)",
      "魏汉涛、王俊杰:《虚开增值税专用发票罪的入罪标准解读》,《武汉科技大学学报》(社会科学版)2024年第4期",
      "魏汉涛、王俊杰:《人类基因科技滥用行为刑法规制之反思》,《中国人民公安大学学报》2024年第4期(CSSCI扩)",
      "魏汉涛:《公民个人信息刑法保护的偏差与匡正》,《法学评论》2024年第4期(CLSCI)",
      "魏汉涛:《私密信息刑法保护的反思与重构》,《政法论坛》2024年第4期,(CLSCI)人大复印资料2024年第10期全文转载",
      "魏汉涛:《人脸识别信息滥用行为刑法规制的顶层设计》,《当代法学》2024年第2期(CLSCI)"
    ],
    "research_directions": [
      "中国刑法学、科技刑法学"
    ],
    "source_url": "https://law.zuel.edu.cn/szdw/list.htm",
    "submitted_department": "法学院",
    "submitted_school": "法学院",
    "submitted_university": "中南财经政法大学",
    "title": "教授"
  },
  "auto_eligible": false,
  "contributor": {
    "account_age_days_at_submission": 1530,
    "account_created_at": "2022-06-13T08:30:46Z",
    "github_login_at_submission": "JunieXD",
    "github_user_id": 107397009,
    "github_user_type": "User",
    "submitted_at": "2026-08-21T18:54:04Z"
  },
  "created_at": "2026-08-21T18:54:38Z",
  "id": "proposal_issue_182_row_123",
  "issue": {
    "batch_row": 123,
    "number": 182,
    "url": "https://github.com/JunieXD/AutoEmailSender-MentorData/issues/182"
  },
  "kind": "mentor_contribution",
  "match_status": "new",
  "review_reasons": [
    "unknown_university",
    "auto_merge_disabled"
  ],
  "schema_version": 1,
  "submitted": {
    "email": "weihantao1108@126.com",
    "mentor_status": "active",
    "name": "魏汉涛",
    "organization_id": null,
    "profile_url": "https://law.zuel.edu.cn/2025/0525/c16276a396073/page.htm",
    "recent_papers": [
      "魏汉涛:《刑法谦抑主义的应然走向》,《环球法律评论》2025年第1期(CLSCI)",
      "魏汉涛、桑宇:《应对人类基因科技潜在风险的模式选择》,《安徽师范大学学报》(社会科学版)2025年第1期(CSSCI扩)",
      "魏汉涛、桑宇:《微罪的刑法治理之困境与出路》,《河北大学学报》(社会科学版)2025年第4期(CSSCI扩)",
      "魏汉涛、王俊杰:《虚开增值税专用发票罪的入罪标准解读》,《武汉科技大学学报》(社会科学版)2024年第4期",
      "魏汉涛、王俊杰:《人类基因科技滥用行为刑法规制之反思》,《中国人民公安大学学报》2024年第4期(CSSCI扩)",
      "魏汉涛:《公民个人信息刑法保护的偏差与匡正》,《法学评论》2024年第4期(CLSCI)",
      "魏汉涛:《私密信息刑法保护的反思与重构》,《政法论坛》2024年第4期,(CLSCI)人大复印资料2024年第10期全文转载",
      "魏汉涛:《人脸识别信息滥用行为刑法规制的顶层设计》,《当代法学》2024年第2期(CLSCI)"
    ],
    "research_directions": [
      "中国刑法学、科技刑法学"
    ],
    "source_url": "https://law.zuel.edu.cn/szdw/list.htm",
    "submitted_department": "法学院",
    "submitted_school": "法学院",
    "submitted_university": "中南财经政法大学",
    "title": "教授"
  },
  "target_mentor_id": null
}
