{
  "accepted": {
    "email": "chenjun6905@163.com",
    "mentor_status": "active",
    "name": "陈军",
    "organization_id": null,
    "profile_url": "https://law.zuel.edu.cn/2025/0525/c16276a396054/page.htm",
    "recent_papers": [
      "2009年1月,编著《法学典型案例分析》教材,哈尔滨工程大学出版社。",
      "2012年11月,独著《突发事件应对与人权保障研究》,中国戏剧出版社。",
      "2017年9月,独撰“法学通识教育实践路径研究——以《以案说法》课程为例”,《高等教育评论》2017年第2期。",
      "2017年10月,独撰“论法学通识课《以案说法》的教材建设”,载入首届全国高校非法学专业法治教育研讨会论文集,获得征文活动优秀论文三等奖。",
      "2020年10月,独撰论文“‘四大检察’改革背景下的检察权能配置探析”,《政法论丛》2020年第五期。",
      "2022年3月,独撰“从历史走向未来:古代冠礼的现代法律意蕴”,入选《中南财经政法大学课程思政优秀案例选编(第一辑)》。",
      "2022年11月,第1作者论文“论习近平全面从严治党‘关键在严’的科学内涵”入选第五届全国党内法规研究学术研讨会论文集。",
      "2025年3月,《法学通论》教材副主编,科学出版社。"
    ],
    "research_directions": [
      "党内法规学、理论法学、案例法学、诉讼法学"
    ],
    "source_url": "https://law.zuel.edu.cn/szdw/list.htm",
    "submitted_department": "法学院",
    "submitted_school": "法学院",
    "submitted_university": "中南财经政法大学",
    "title": "副教授"
  },
  "auto_eligible": false,
  "contributor": {
    "account_age_days_at_submission": 1530,
    "account_created_at": "2022-06-13T08:30:46Z",
    "github_login_at_submission": "JunieXD",
    "github_user_id": 107397009,
    "github_user_type": "User",
    "submitted_at": "2026-08-21T18:54:04Z"
  },
  "created_at": "2026-08-21T18:54:38Z",
  "id": "proposal_issue_182_row_11",
  "issue": {
    "batch_row": 11,
    "number": 182,
    "url": "https://github.com/JunieXD/AutoEmailSender-MentorData/issues/182"
  },
  "kind": "mentor_contribution",
  "match_status": "new",
  "review_reasons": [
    "unknown_university",
    "auto_merge_disabled"
  ],
  "schema_version": 1,
  "submitted": {
    "email": "chenjun6905@163.com",
    "mentor_status": "active",
    "name": "陈军",
    "organization_id": null,
    "profile_url": "https://law.zuel.edu.cn/2025/0525/c16276a396054/page.htm",
    "recent_papers": [
      "2009年1月,编著《法学典型案例分析》教材,哈尔滨工程大学出版社。",
      "2012年11月,独著《突发事件应对与人权保障研究》,中国戏剧出版社。",
      "2017年9月,独撰“法学通识教育实践路径研究——以《以案说法》课程为例”,《高等教育评论》2017年第2期。",
      "2017年10月,独撰“论法学通识课《以案说法》的教材建设”,载入首届全国高校非法学专业法治教育研讨会论文集,获得征文活动优秀论文三等奖。",
      "2020年10月,独撰论文“‘四大检察’改革背景下的检察权能配置探析”,《政法论丛》2020年第五期。",
      "2022年3月,独撰“从历史走向未来:古代冠礼的现代法律意蕴”,入选《中南财经政法大学课程思政优秀案例选编(第一辑)》。",
      "2022年11月,第1作者论文“论习近平全面从严治党‘关键在严’的科学内涵”入选第五届全国党内法规研究学术研讨会论文集。",
      "2025年3月,《法学通论》教材副主编,科学出版社。"
    ],
    "research_directions": [
      "党内法规学、理论法学、案例法学、诉讼法学"
    ],
    "source_url": "https://law.zuel.edu.cn/szdw/list.htm",
    "submitted_department": "法学院",
    "submitted_school": "法学院",
    "submitted_university": "中南财经政法大学",
    "title": "副教授"
  },
  "target_mentor_id": null
}
