{
  "accepted": {
    "email": "liusong@hnu.edu.cn",
    "mentor_status": "active",
    "name": "刘松",
    "organization_id": null,
    "profile_url": "http://grzy.hnu.edu.cn/site/index/liusong",
    "recent_papers": [
      "Liu, Tao#; Liu, Song#; Tu, Kun-Hua; Schmidt, Hennrik; Chu, Leiqiang; Xiang, Du; Martin, Jens; Eda, Goki; Ross, Caroline A.; Garaj, Slaven*, Crested two-dimensional transistors, Nature Nanotechnology, 2019, 14, 223-226",
      "Chen, Mao-Lin; Sun, Xingdan; Liu, Hang; Wang, Hanwen; Zhu, Qianbing; Wang, Shasha; Du, Haifeng; Dong, Baojuan; Zhang, Jing; Sun, Yun; Qiu, Song; Alava, Thomas; Liu, Song*; Sun, Dong-Ming*; Han, Zheng*, A FinFET with one atomic layer channel, Nature Communications, 2020, 11, 1205",
      "Xu, Jie; Shao, Gonglei; Tang, Xuan; Lv, Fang; Xiang, Haiyan; Jing, Changfei; Liu, Song*; Dai, Sheng*; Li, Yanguang*; Luo, Jun*; Zhou, Zhen, Frenkel-defected monolayer MoS2 catalysts for efficient hydrogen evolution, Nature Communications, 2022, 13, 2193",
      "Shao, Gonglei; Xue, Xiong-Xiong; Zhou, Xionglin; Xu, Jie; Jin, Yuanyuan; Qi, Shuyan; Liu, Nan; Duan, Huigao; Wang, Shanshan; Li, Shisheng; Ouzounian, Miray; Hu, Travis Shihao; Luo, Jun; Liu, Song*; Feng, Yexin*, Shape-engineered synthesis of atomically thin 1T-SnS2 xatalyzed by potassium halides, ACS Nano, 2019, 13, 8265-8274",
      "Shao, Gonglei; Xue, Xiong-Xiong; Wu, Binbin; Lin, Yung-Chang; Ouzounian, Miray; Hu, Travis Shihao; Xu, Yeqing; Liu, Xiao; Li, Shisheng; Suenaga, Kazu; Feng, Yexin*; Liu, Song*, Template-assisted synthesis of metallic 1T’-Sn0.3W0.7S2 nanosheets for hydrogen evolution reaction , Advanced Functional Materials, 2020, 30, 1906069"
    ],
    "research_directions": [
      "低维材料的可控制备与功能仿生器件"
    ],
    "source_url": "https://sic.hnu.edu.cn/teachers/jslb.htm",
    "submitted_department": "化学化工学院",
    "submitted_school": "半导体学院(集成电路学院)",
    "submitted_university": "湖南大学",
    "title": "教授"
  },
  "auto_eligible": false,
  "contributor": {
    "account_age_days_at_submission": 1516,
    "account_created_at": "2022-06-13T08:30:46Z",
    "github_login_at_submission": "JunieXD",
    "github_user_id": 107397009,
    "github_user_type": "User",
    "submitted_at": "2026-08-07T14:02:43Z"
  },
  "created_at": "2026-08-07T14:03:07Z",
  "id": "proposal_issue_22_row_35",
  "issue": {
    "batch_row": 35,
    "number": 22,
    "url": "https://github.com/JunieXD/AutoEmailSender-MentorData/issues/22"
  },
  "kind": "mentor_contribution",
  "match_status": "new",
  "review_reasons": [
    "unknown_university",
    "auto_merge_disabled"
  ],
  "schema_version": 1,
  "submitted": {
    "email": "liusong@hnu.edu.cn",
    "mentor_status": "active",
    "name": "刘松",
    "organization_id": null,
    "profile_url": "http://grzy.hnu.edu.cn/site/index/liusong",
    "recent_papers": [
      "Liu, Tao#; Liu, Song#; Tu, Kun-Hua; Schmidt, Hennrik; Chu, Leiqiang; Xiang, Du; Martin, Jens; Eda, Goki; Ross, Caroline A.; Garaj, Slaven*, Crested two-dimensional transistors, Nature Nanotechnology, 2019, 14, 223-226",
      "Chen, Mao-Lin; Sun, Xingdan; Liu, Hang; Wang, Hanwen; Zhu, Qianbing; Wang, Shasha; Du, Haifeng; Dong, Baojuan; Zhang, Jing; Sun, Yun; Qiu, Song; Alava, Thomas; Liu, Song*; Sun, Dong-Ming*; Han, Zheng*, A FinFET with one atomic layer channel, Nature Communications, 2020, 11, 1205",
      "Xu, Jie; Shao, Gonglei; Tang, Xuan; Lv, Fang; Xiang, Haiyan; Jing, Changfei; Liu, Song*; Dai, Sheng*; Li, Yanguang*; Luo, Jun*; Zhou, Zhen, Frenkel-defected monolayer MoS2 catalysts for efficient hydrogen evolution, Nature Communications, 2022, 13, 2193",
      "Shao, Gonglei; Xue, Xiong-Xiong; Zhou, Xionglin; Xu, Jie; Jin, Yuanyuan; Qi, Shuyan; Liu, Nan; Duan, Huigao; Wang, Shanshan; Li, Shisheng; Ouzounian, Miray; Hu, Travis Shihao; Luo, Jun; Liu, Song*; Feng, Yexin*, Shape-engineered synthesis of atomically thin 1T-SnS2 xatalyzed by potassium halides, ACS Nano, 2019, 13, 8265-8274",
      "Shao, Gonglei; Xue, Xiong-Xiong; Wu, Binbin; Lin, Yung-Chang; Ouzounian, Miray; Hu, Travis Shihao; Xu, Yeqing; Liu, Xiao; Li, Shisheng; Suenaga, Kazu; Feng, Yexin*; Liu, Song*, Template-assisted synthesis of metallic 1T’-Sn0.3W0.7S2 nanosheets for hydrogen evolution reaction , Advanced Functional Materials, 2020, 30, 1906069"
    ],
    "research_directions": [
      "低维材料的可控制备与功能仿生器件"
    ],
    "source_url": "https://sic.hnu.edu.cn/teachers/jslb.htm",
    "submitted_department": "化学化工学院",
    "submitted_school": "半导体学院(集成电路学院)",
    "submitted_university": "湖南大学",
    "title": "教授"
  },
  "target_mentor_id": null
}
