{
  "accepted": {
    "email": "hui.wang@hrbeu.edu.cn",
    "mentor_status": "active",
    "name": "王辉",
    "organization_id": null,
    "profile_url": "https://faculty.hrbeu.edu.cn/wanghui_cs/zh_CN/index.htm",
    "recent_papers": [],
    "research_directions": [
      "人机计算与人机协作、群智感知计算、具身智能"
    ],
    "source_url": "http://cstc.hrbeu.edu.cn/3663/list.htm",
    "submitted_department": "计算机科学与技术学院(电子政务建模仿真国家工程实验室)、国家保密学院、软件学院",
    "submitted_school": "计算机科学与技术学院",
    "submitted_university": "哈尔滨工程大学",
    "title": null
  },
  "auto_eligible": false,
  "contributor": {
    "account_age_days_at_submission": 1530,
    "account_created_at": "2022-06-13T08:30:46Z",
    "github_login_at_submission": "JunieXD",
    "github_user_id": 107397009,
    "github_user_type": "User",
    "submitted_at": "2026-08-21T18:46:55Z"
  },
  "created_at": "2026-08-21T18:47:35Z",
  "id": "proposal_issue_122_row_53",
  "issue": {
    "batch_row": 53,
    "number": 122,
    "url": "https://github.com/JunieXD/AutoEmailSender-MentorData/issues/122"
  },
  "kind": "mentor_contribution",
  "match_status": "new",
  "review_reasons": [
    "unknown_university",
    "auto_merge_disabled"
  ],
  "schema_version": 1,
  "submitted": {
    "email": "hui.wang@hrbeu.edu.cn",
    "mentor_status": "active",
    "name": "王辉",
    "organization_id": null,
    "profile_url": "https://faculty.hrbeu.edu.cn/wanghui_cs/zh_CN/index.htm",
    "recent_papers": [],
    "research_directions": [
      "人机计算与人机协作、群智感知计算、具身智能"
    ],
    "source_url": "http://cstc.hrbeu.edu.cn/3663/list.htm",
    "submitted_department": "计算机科学与技术学院(电子政务建模仿真国家工程实验室)、国家保密学院、软件学院",
    "submitted_school": "计算机科学与技术学院",
    "submitted_university": "哈尔滨工程大学",
    "title": null
  },
  "target_mentor_id": null
}
