{
  "accepted": {
    "email": "zhouzhengyong@hust.edu.cn",
    "mentor_status": "active",
    "name": "周正勇",
    "organization_id": "org_auto_ff647878db706f701703",
    "profile_url": "http://faculty.hust.edu.cn/zhouzhengyong/zh_CN/index.htm",
    "recent_papers": [],
    "research_directions": [],
    "source_url": "https://cs.hust.edu.cn/szdw/jsml/axmpyszmlb.htm",
    "submitted_department": "计算机科学与技术学院",
    "submitted_school": "计算机学院",
    "submitted_university": "华中科技大学",
    "title": null
  },
  "auto_eligible": false,
  "contributor": {
    "account_age_days_at_submission": 1512,
    "account_created_at": "2022-06-13T08:30:46Z",
    "github_login_at_submission": "JunieXD",
    "github_user_id": 107397009,
    "github_user_type": "User",
    "submitted_at": "2026-08-03T12:54:04Z"
  },
  "created_at": "2026-08-03T13:42:50Z",
  "id": "proposal_issue_1_row_110",
  "issue": {
    "batch_row": 110,
    "number": 1,
    "url": "https://github.com/JunieXD/AutoEmailSender-MentorData/issues/1"
  },
  "kind": "mentor_contribution",
  "match_status": "new",
  "review_reasons": [
    "unknown_university",
    "auto_merge_disabled"
  ],
  "schema_version": 1,
  "submitted": {
    "email": "zhouzhengyong@hust.edu.cn",
    "mentor_status": "active",
    "name": "周正勇",
    "organization_id": null,
    "profile_url": "http://faculty.hust.edu.cn/zhouzhengyong/zh_CN/index.htm",
    "recent_papers": [],
    "research_directions": [],
    "source_url": "https://cs.hust.edu.cn/szdw/jsml/axmpyszmlb.htm",
    "submitted_department": "计算机科学与技术学院",
    "submitted_school": "计算机学院",
    "submitted_university": "华中科技大学",
    "title": null
  },
  "target_mentor_id": null
}
