{
  "accepted": {
    "email": "bingxingchen@fzu.edu.cn",
    "mentor_status": "active",
    "name": "陈炳兴",
    "organization_id": null,
    "profile_url": "https://jxxy.fzu.edu.cn/info/1387/11696.htm",
    "recent_papers": [
      "Zhang Y, et al. Extreme Mechanics Letters, 2025: 102312.",
      "Ding F, et al. Ocean Engineering, 2025.328(1):121063.",
      "Soft Robotics. 2025. 12, 5, 676-686.",
      "IEEE Robotics and Automation Letters, 2025.10(7):6800-6807.",
      "Ding F, et al. Smart Materials and Structures, 2025, 34(5): 055023.",
      "Zheng Z, et al. IEEE Robotics and Automation Letters, 2025.10(10):10870-10877.",
      "Ye F, et al. Smart Materials and Structures, 2025, 34(5): 095004.",
      "Chen W, et al. Nonlinear Dynamics, 2025, Accept."
    ],
    "research_directions": [
      "具身智能机器人系统(仿生机器人、软体机器人、特种机器人应用等)、机器人智能规划与非线性控制、具身环境感知与多模态人机交互"
    ],
    "source_url": "https://jxxy.fzu.edu.cn/jsdw/jsml1/jxsjx.htm",
    "submitted_department": "机械设计系",
    "submitted_school": "机械工程及自动化学院",
    "submitted_university": "福州大学",
    "title": "教授"
  },
  "auto_eligible": false,
  "contributor": {
    "account_age_days_at_submission": 1530,
    "account_created_at": "2022-06-13T08:30:46Z",
    "github_login_at_submission": "JunieXD",
    "github_user_id": 107397009,
    "github_user_type": "User",
    "submitted_at": "2026-08-21T18:44:57Z"
  },
  "created_at": "2026-08-21T18:45:35Z",
  "id": "proposal_issue_113_row_5",
  "issue": {
    "batch_row": 5,
    "number": 113,
    "url": "https://github.com/JunieXD/AutoEmailSender-MentorData/issues/113"
  },
  "kind": "mentor_contribution",
  "match_status": "new",
  "review_reasons": [
    "unknown_university",
    "auto_merge_disabled"
  ],
  "schema_version": 1,
  "submitted": {
    "email": "bingxingchen@fzu.edu.cn",
    "mentor_status": "active",
    "name": "陈炳兴",
    "organization_id": null,
    "profile_url": "https://jxxy.fzu.edu.cn/info/1387/11696.htm",
    "recent_papers": [
      "Zhang Y, et al. Extreme Mechanics Letters, 2025: 102312.",
      "Ding F, et al. Ocean Engineering, 2025.328(1):121063.",
      "Soft Robotics. 2025. 12, 5, 676-686.",
      "IEEE Robotics and Automation Letters, 2025.10(7):6800-6807.",
      "Ding F, et al. Smart Materials and Structures, 2025, 34(5): 055023.",
      "Zheng Z, et al. IEEE Robotics and Automation Letters, 2025.10(10):10870-10877.",
      "Ye F, et al. Smart Materials and Structures, 2025, 34(5): 095004.",
      "Chen W, et al. Nonlinear Dynamics, 2025, Accept."
    ],
    "research_directions": [
      "具身智能机器人系统(仿生机器人、软体机器人、特种机器人应用等)、机器人智能规划与非线性控制、具身环境感知与多模态人机交互"
    ],
    "source_url": "https://jxxy.fzu.edu.cn/jsdw/jsml1/jxsjx.htm",
    "submitted_department": "机械设计系",
    "submitted_school": "机械工程及自动化学院",
    "submitted_university": "福州大学",
    "title": "教授"
  },
  "target_mentor_id": null
}
