{
  "accepted": {
    "email": "boren@xidian.edu.cn",
    "mentor_status": "active",
    "name": "任博",
    "organization_id": null,
    "profile_url": "https://faculty.xidian.edu.cn/RB/zh_CN/index.htm",
    "recent_papers": [],
    "research_directions": [
      "大数据智能解译、深度学习、增量学习、遥感影像智能解译、多模态数据表征与学习、语义表达与生成、复杂影像分析"
    ],
    "source_url": "https://hz.xidian.edu.cn/info/1201/40244.htm",
    "submitted_department": "人工智能学院",
    "submitted_school": "杭州研究院",
    "submitted_university": "西安电子科技大学",
    "title": "副教授"
  },
  "auto_eligible": false,
  "contributor": {
    "account_age_days_at_submission": 1520,
    "account_created_at": "2022-06-13T08:30:46Z",
    "github_login_at_submission": "JunieXD",
    "github_user_id": 107397009,
    "github_user_type": "User",
    "submitted_at": "2026-08-11T10:04:15Z"
  },
  "created_at": "2026-08-11T10:04:39Z",
  "id": "proposal_issue_34_row_177",
  "issue": {
    "batch_row": 177,
    "number": 34,
    "url": "https://github.com/JunieXD/AutoEmailSender-MentorData/issues/34"
  },
  "kind": "mentor_contribution",
  "match_status": "new",
  "review_reasons": [
    "unknown_university",
    "auto_merge_disabled"
  ],
  "schema_version": 1,
  "submitted": {
    "email": "boren@xidian.edu.cn",
    "mentor_status": "active",
    "name": "任博",
    "organization_id": null,
    "profile_url": "https://faculty.xidian.edu.cn/RB/zh_CN/index.htm",
    "recent_papers": [],
    "research_directions": [
      "大数据智能解译、深度学习、增量学习、遥感影像智能解译、多模态数据表征与学习、语义表达与生成、复杂影像分析"
    ],
    "source_url": "https://hz.xidian.edu.cn/info/1201/40244.htm",
    "submitted_department": "人工智能学院",
    "submitted_school": "杭州研究院",
    "submitted_university": "西安电子科技大学",
    "title": "副教授"
  },
  "target_mentor_id": null
}
