{
  "accepted": {
    "email": "lijun-ius@zuel.edu.cn",
    "mentor_status": "active",
    "name": "李俊",
    "organization_id": null,
    "profile_url": "https://law.zuel.edu.cn/2025/0525/c16276a396830/page.htm",
    "recent_papers": [],
    "research_directions": [
      "民商法、罗马法"
    ],
    "source_url": "https://law.zuel.edu.cn/szdw/list.htm",
    "submitted_department": "法与经济学院",
    "submitted_school": "法学院",
    "submitted_university": "中南财经政法大学",
    "title": "教授"
  },
  "auto_eligible": false,
  "contributor": {
    "account_age_days_at_submission": 1530,
    "account_created_at": "2022-06-13T08:30:46Z",
    "github_login_at_submission": "JunieXD",
    "github_user_id": 107397009,
    "github_user_type": "User",
    "submitted_at": "2026-08-21T18:54:04Z"
  },
  "created_at": "2026-08-21T18:54:38Z",
  "id": "proposal_issue_182_row_88",
  "issue": {
    "batch_row": 88,
    "number": 182,
    "url": "https://github.com/JunieXD/AutoEmailSender-MentorData/issues/182"
  },
  "kind": "mentor_contribution",
  "match_status": "new",
  "review_reasons": [
    "unknown_university",
    "auto_merge_disabled"
  ],
  "schema_version": 1,
  "submitted": {
    "email": "lijun-ius@zuel.edu.cn",
    "mentor_status": "active",
    "name": "李俊",
    "organization_id": null,
    "profile_url": "https://law.zuel.edu.cn/2025/0525/c16276a396830/page.htm",
    "recent_papers": [],
    "research_directions": [
      "民商法、罗马法"
    ],
    "source_url": "https://law.zuel.edu.cn/szdw/list.htm",
    "submitted_department": "法与经济学院",
    "submitted_school": "法学院",
    "submitted_university": "中南财经政法大学",
    "title": "教授"
  },
  "target_mentor_id": null
}
